{
  "$schema": "https://json-schema.org/draft/2020-12/schema",
  "$id": "https://github.com/zhanghao1903/macos-computer-use/blob/main/plugins/codex-claude-engineering-lifecycle/schemas/technical-plan-review-request.schema.json",
  "title": "TechnicalPlanReviewRequest",
  "type": "object",
  "additionalProperties": false,
  "required": ["schemaVersion", "type", "workflowId", "messageId", "featureId", "repositoryKey", "routing", "cycle", "createdAt", "body"],
  "properties": {
    "schemaVersion": {"const": 1},
    "type": {"const": "TechnicalPlanReviewRequest"},
    "workflowId": {"type": "string", "format": "uuid"},
    "messageId": {"$ref": "#/$defs/digest"},
    "featureId": {"$ref": "#/$defs/featureId"},
    "repositoryKey": {"type": "string", "pattern": "^[A-Za-z0-9_.-]+/[A-Za-z0-9_.-]+$", "maxLength": 300},
    "routing": {"$ref": "#/$defs/routing"},
    "cycle": {"type": "integer", "minimum": 1},
    "createdAt": {"$ref": "#/$defs/timestamp"},
    "body": {
      "type": "object",
      "additionalProperties": false,
      "required": ["plan", "reviewRecordBranch", "acceptanceCriteriaDigest"],
      "properties": {
        "plan": {
          "type": "object",
          "additionalProperties": false,
          "required": ["requirements", "design", "implementationPlan", "planCommitSha", "compositeSha256"],
          "properties": {
            "requirements": {"$ref": "#/$defs/artifact"},
            "design": {"$ref": "#/$defs/artifact"},
            "implementationPlan": {"$ref": "#/$defs/artifact"},
            "planCommitSha": {"$ref": "#/$defs/sha"},
            "compositeSha256": {"$ref": "#/$defs/digest"}
          }
        },
        "reviewRecordBranch": {"type": "string", "pattern": "^codex/review-records/.+/plan-[1-9][0-9]*-[0-9a-f]{12}$", "maxLength": 240},
        "acceptanceCriteriaDigest": {"$ref": "#/$defs/digest"},
        "previousResultMessageId": {"$ref": "#/$defs/digest"}
      }
    }
  },
  "$defs": {
    "digest": {"type": "string", "pattern": "^[0-9a-f]{64}$"},
    "sha": {"type": "string", "pattern": "^[0-9a-f]{40}$"},
    "featureId": {"type": "string", "pattern": "^[a-z0-9](?:[a-z0-9-]{0,62}[a-z0-9])?-[0-9a-f]{12}$", "maxLength": 76},
    "timestamp": {"type": "string", "format": "date-time", "pattern": "^\\d{4}-\\d{2}-\\d{2}T\\d{2}:\\d{2}:\\d{2}Z$"},
    "path": {"type": "string", "minLength": 1, "maxLength": 500, "pattern": "^(?!/)(?!.*(?:^|/)\\.\\.(?:/|$))(?!.*\\\\).+$"},
    "routing": {
      "type": "object",
      "additionalProperties": false,
      "required": ["sourceTaskId", "destinationTaskId"],
      "properties": {
        "sourceTaskId": {"type": "string", "minLength": 1, "maxLength": 200},
        "destinationTaskId": {"type": "string", "minLength": 1, "maxLength": 200}
      }
    },
    "artifact": {
      "type": "object",
      "additionalProperties": false,
      "required": ["path", "commitSha", "sha256"],
      "properties": {
        "path": {"$ref": "#/$defs/path"},
        "commitSha": {"$ref": "#/$defs/sha"},
        "sha256": {"$ref": "#/$defs/digest"}
      }
    }
  }
}
